{
  "fabricantes": [
    {
      "id": "ecebf57f-20e1-56b7-8bd3-21fc64c108af",
      "nome": "Lar Cooperativa Agroindustrial",
      "cnpj": "76.879.878/0001-00",
      "site_oficial": "https://www.lar.ind.br",
      "ativo": true,
      "criado_em": "2026-10-22T12:13:50.848Z"
    }
  ],
  "marcas": [
    {
      "id": "e34195f6-bc57-5db6-98df-f8c5ff66a708",
      "fabricante_id": "ecebf57f-20e1-56b7-8bd3-21fc64c108af",
      "nome": "Lar",
      "slug": "lar",
      "descricao": "Produtos da Lar Cooperativa Agroindustrial",
      "ativo": true,
      "criado_em": "2026-10-22T12:13:50.848Z"
    }
  ],
  "produtos": [
    {
      "id": "11dbc97b-03b4-574e-8dd9-dc62434bd575",
      "marca_id": "e34195f6-bc57-5db6-98df-f8c5ff66a708",
      "descricao_padronizada": "Batata Airfryer 1,005kg",
      "descricao_original": "Batata Airfryer 1,005kg",
      "classe": "Vegetais & Congelados",
      "conservacao": "Congelado",
      "peso_gramas": 1005,
      "fracionado": false,
      "imagem_url": "/imagens_produtos/7896419730729.webp",
      "status_imagem": "aprovado",
      "criado_em": "2026-10-22T12:13:50.848Z"
    },
    {
      "id": "2adaccd2-d003-55a5-846f-e5c2599f39d6",
      "marca_id": "e34195f6-bc57-5db6-98df-f8c5ff66a708",
      "descricao_padronizada": "Filé de Tilápia 700g",
      "descricao_original": "Filé de Tilápia 700g",
      "classe": "Pescados",
      "conservacao": "Congelado",
      "peso_gramas": 700,
      "fracionado": false,
      "imagem_url": "/imagens_produtos/7896419731917.webp",
      "status_imagem": "aprovado",
      "criado_em": "2026-10-22T12:13:50.848Z"
    },
    {
      "id": "ab31fde4-e8da-5d99-8fb3-2dd5cd6594af",
      "marca_id": "e34195f6-bc57-5db6-98df-f8c5ff66a708",
      "descricao_padronizada": "Filé de Tilápia Food Service 5kg",
      "descricao_original": "Filé de Tilápia Food Service 5kg",
      "classe": "Pescados",
      "conservacao": "Congelado",
      "peso_gramas": 5000,
      "fracionado": false,
      "imagem_url": "/imagens_produtos/7896419731801.webp",
      "status_imagem": "aprovado",
      "criado_em": "2026-10-22T12:13:50.848Z"
    },
    {
      "id": "dd7675a5-15f0-5aa2-a9da-c777b5a0e2fd",
      "marca_id": "e34195f6-bc57-5db6-98df-f8c5ff66a708",
      "descricao_padronizada": "Filé de Tilápia 400g",
      "descricao_original": "Filé de Tilápia 400g",
      "classe": "Pescados",
      "conservacao": "Congelado",
      "peso_gramas": 400,
      "fracionado": false,
      "imagem_url": "/imagens_produtos/7896419731900.webp",
      "status_imagem": "aprovado",
      "criado_em": "2026-10-22T12:13:50.848Z"
    },
    {
      "id": "fe0f3bf7-f6db-5409-a26f-f233bfbae6f3",
      "marca_id": "e34195f6-bc57-5db6-98df-f8c5ff66a708",
      "descricao_padronizada": "Anéis de Cebola 1,1kg",
      "descricao_original": "Anéis de Cebola 1,1kg",
      "classe": "Vegetais & Congelados",
      "conservacao": "Congelado",
      "peso_gramas": 1100,
      "fracionado": false,
      "imagem_url": "/imagens_produtos/7896419720270.webp",
      "status_imagem": "aprovado",
      "criado_em": "2026-10-22T12:13:50.848Z"
    },
    {
      "id": "401287cc-bf24-51e0-a9de-49b8b7e7f681",
      "marca_id": "e34195f6-bc57-5db6-98df-f8c5ff66a708",
      "descricao_padronizada": "Anéis de Cebola 400g",
      "descricao_original": "Anéis de Cebola 400g",
      "classe": "Vegetais & Congelados",
      "conservacao": "Congelado",
      "peso_gramas": 400,
      "fracionado": false,
      "imagem_url": "/imagens_produtos/7896419720287.webp",
      "status_imagem": "aprovado",
      "criado_em": "2026-10-22T12:13:50.848Z"
    },
    {
      "id": "eb852974-716e-5742-bd11-f88786c97a9d",
      "marca_id": "e34195f6-bc57-5db6-98df-f8c5ff66a708",
      "descricao_padronizada": "Batata Palito 1,5kg",
      "descricao_original": "Batata Palito 1,5kg",
      "classe": "Vegetais & Congelados",
      "conservacao": "Congelado",
      "peso_gramas": 1500,
      "fracionado": false,
      "imagem_url": "/imagens_produtos/7896419730705.webp",
      "status_imagem": "aprovado",
      "criado_em": "2026-10-22T12:13:50.848Z"
    },
    {
      "id": "5b965366-4e3b-524c-80fd-8a7c148e5589",
      "marca_id": "e34195f6-bc57-5db6-98df-f8c5ff66a708",
      "descricao_padronizada": "Batata Palito 700g",
      "descricao_original": "Batata Palito 700g",
      "classe": "Vegetais & Congelados",
      "conservacao": "Congelado",
      "peso_gramas": 700,
      "fracionado": false,
      "imagem_url": "/imagens_produtos/7896419730347.webp",
      "status_imagem": "aprovado",
      "criado_em": "2026-10-22T12:13:50.848Z"
    },
    {
      "id": "e6284360-e6b9-5819-8232-af9e5ffded7d",
      "marca_id": "e34195f6-bc57-5db6-98df-f8c5ff66a708",
      "descricao_padronizada": "Polenta Palito 1,1kg",
      "descricao_original": "Polenta Palito 1,1kg",
      "classe": "Vegetais & Congelados",
      "conservacao": "Congelado",
      "peso_gramas": 1100,
      "fracionado": false,
      "imagem_url": "/imagens_produtos/7896419724384.webp",
      "status_imagem": "aprovado",
      "criado_em": "2026-10-22T12:13:50.848Z"
    },
    {
      "id": "64c35b3d-e01a-5659-9007-e5dca522486a",
      "marca_id": "e34195f6-bc57-5db6-98df-f8c5ff66a708",
      "descricao_padronizada": "Polenta Palito 400g",
      "descricao_original": "Polenta Palito 400g",
      "classe": "Vegetais & Congelados",
      "conservacao": "Congelado",
      "peso_gramas": 400,
      "fracionado": false,
      "imagem_url": "/imagens_produtos/7896419712770.webp",
      "status_imagem": "aprovado",
      "criado_em": "2026-10-22T12:13:50.848Z"
    },
    {
      "id": "2c7cf502-cdfa-5506-a395-bd23295f2b88",
      "marca_id": "e34195f6-bc57-5db6-98df-f8c5ff66a708",
      "descricao_padronizada": "Coração Bandeja 1kg",
      "descricao_original": "Coração Bandeja 1kg",
      "classe": "Aves",
      "conservacao": "Congelado",
      "peso_gramas": 1000,
      "fracionado": false,
      "imagem_url": "/imagens_produtos/7896419728887.webp",
      "status_imagem": "aprovado",
      "criado_em": "2026-10-22T12:13:50.848Z"
    },
    {
      "id": "636a6278-e2fc-51dd-9607-70333de0dadc",
      "marca_id": "e34195f6-bc57-5db6-98df-f8c5ff66a708",
      "descricao_padronizada": "Coração Bandeja 600g",
      "descricao_original": "Coração Bandeja 600g",
      "classe": "Aves",
      "conservacao": "Congelado",
      "peso_gramas": 600,
      "fracionado": false,
      "imagem_url": "/imagens_produtos/7896419727286.webp",
      "status_imagem": "aprovado",
      "criado_em": "2026-10-22T12:13:50.848Z"
    },
    {
      "id": "ca6a63e8-da7a-5120-bbaa-56d945c5b400",
      "marca_id": "e34195f6-bc57-5db6-98df-f8c5ff66a708",
      "descricao_padronizada": "Coxas e Sobrecoxas Bandeja 1kg",
      "descricao_original": "Coxas e Sobrecoxas Bandeja 1kg",
      "classe": "Aves",
      "conservacao": "Congelado",
      "peso_gramas": 1000,
      "fracionado": false,
      "imagem_url": "/imagens_produtos/7896419728900.webp",
      "status_imagem": "aprovado",
      "criado_em": "2026-10-22T12:13:50.848Z"
    },
    {
      "id": "baa68724-7028-55d7-978f-d1c2d337d614",
      "marca_id": "e34195f6-bc57-5db6-98df-f8c5ff66a708",
      "descricao_padronizada": "Coxinha da Asa Bandeja 1kg",
      "descricao_original": "Coxinha da Asa Bandeja 1kg",
      "classe": "Aves",
      "conservacao": "Congelado",
      "peso_gramas": 1000,
      "fracionado": false,
      "imagem_url": "/imagens_produtos/7896419728894.webp",
      "status_imagem": "aprovado",
      "criado_em": "2026-10-22T12:13:50.848Z"
    },
    {
      "id": "bcb2fe2c-2bc8-5f2b-809c-abf3184381c7",
      "marca_id": "e34195f6-bc57-5db6-98df-f8c5ff66a708",
      "descricao_padronizada": "Coxinha da Asa Bandeja 600g",
      "descricao_original": "Coxinha da Asa Bandeja 600g",
      "classe": "Aves",
      "conservacao": "Congelado",
      "peso_gramas": 600,
      "fracionado": false,
      "imagem_url": "/imagens_produtos/7896419727309.webp",
      "status_imagem": "aprovado",
      "criado_em": "2026-10-22T12:13:50.848Z"
    },
    {
      "id": "c1a2215d-573a-5b74-9614-4c9330c6b372",
      "marca_id": "e34195f6-bc57-5db6-98df-f8c5ff66a708",
      "descricao_padronizada": "Filé de Peito Bandeja 1kg",
      "descricao_original": "Filé de Peito Bandeja 1kg",
      "classe": "Aves",
      "conservacao": "Congelado",
      "peso_gramas": 1000,
      "fracionado": false,
      "imagem_url": "/imagens_produtos/7896419728870.webp",
      "status_imagem": "aprovado",
      "criado_em": "2026-10-22T12:13:50.848Z"
    },
    {
      "id": "94ff3e8b-fd38-5624-b9b4-ba4eede14d76",
      "marca_id": "e34195f6-bc57-5db6-98df-f8c5ff66a708",
      "descricao_padronizada": "Filé de Peito Bandeja 600g",
      "descricao_original": "Filé de Peito Bandeja 600g",
      "classe": "Aves",
      "conservacao": "Congelado",
      "peso_gramas": 600,
      "fracionado": false,
      "imagem_url": "/imagens_produtos/7896419727316.webp",
      "status_imagem": "aprovado",
      "criado_em": "2026-10-22T12:13:50.848Z"
    },
    {
      "id": "bd74c756-d439-55d1-88d9-b343eb26ae09",
      "marca_id": "e34195f6-bc57-5db6-98df-f8c5ff66a708",
      "descricao_padronizada": "Filezinho Sassami Bandeja 1kg",
      "descricao_original": "Filezinho Sassami Bandeja 1kg",
      "classe": "Aves",
      "conservacao": "Congelado",
      "peso_gramas": 1000,
      "fracionado": false,
      "imagem_url": "/imagens_produtos/7896419728917.webp",
      "status_imagem": "aprovado",
      "criado_em": "2026-10-22T12:13:50.848Z"
    },
    {
      "id": "758a6cba-a194-5383-a930-a965b2d708b4",
      "marca_id": "e34195f6-bc57-5db6-98df-f8c5ff66a708",
      "descricao_padronizada": "Filezinho Sassami Bandeja 600g",
      "descricao_original": "Filezinho Sassami Bandeja 600g",
      "classe": "Aves",
      "conservacao": "Congelado",
      "peso_gramas": 600,
      "fracionado": false,
      "imagem_url": "/imagens_produtos/7896419727323.webp",
      "status_imagem": "aprovado",